name,email,phone,clock_num,role,salary_level,delegacion,compensations,comp_amount,status,salary,labor
Jesús Fidel Valenzuela Sandoval,,6621273298,5324,Oficial de Brigada,27,Hermosillo,0,0,Activo,0,8
Germán Cázares Sánchez,,6621896943,5026,Oficial de Brigada,27,Hermosillo,1,1500,Activo,0,8
Ernesto Moya Serrato,,6621524276,4505,Técnico Brigadista,27,Hermosillo,0,,Activo,0,8
Ismael Ernesto Ruiz Madrid,,6622980960,5325,Técnico Brigadista,27,Hermosillo,0,,Activo,0,8
José Guadalupe Ortega Rodríguez,,6621600060,2147,Almacenista,27,Hermosillo,0,,Activo,0,8
Nancy Aurora Ruiz López,ruizl.nancy@sonora.edu.mx,6621812522,1596,Despacho,27,Hermosillo,1,2500,Activo,0,8
Miguel Alberto Martínez Escalante,martineze.miguel@sonora.edu.mx,6621016182,5814,Subdirector,10,Hermosillo,1,5000,Activo,0,8
